SYNTAX	CATEGORY	DESCRIPTION	GROUP	KEYWORDS	CLASS	TYPE	TIO	DOCS
{ok}←{opts←'q'} dfns.test script	System	Run test script: no news => good news		qualityassurance unittesting autoformat QA testing	Dfn	Function		https://dfns.dyalog.com/n_test.htm
{excl←'⍵'} dfns.wsdiff (wsa wsb)	System	Workspace differences		compareworkspaces name-clashproblem nameclashproblem	Dfn	Function		https://dfns.dyalog.com/n_wsdiff.htm
Xv(+/∧\⍤⌽⍤=)Yv	Comparison	Count number of trailing elements that are equal between two vectors of equal length		suffix matching onright items end match	Dfn	Dyadic Function		
Xv(+/∧\⍤⌽⍤≠)Yv	Comparison	Count number of trailing elements that are unequal between two vectors of equal length		suffix different onright items end differ	Dfn	Dyadic Function		
{1≥|-/¨⍳2⍴⍵}Jv	Mathematical	Tridiagonal matrix of size Jv (n or m,n)		tri-diagonal banded	Dfn	Monadic Function	https://tio.run/##AS0A0v9hcGwtZHlhbG9n///ijpXihpB7MeKJpXwtL8Ko4o2zMuKNtOKNtX0gNiA3//8	
{2≥|-/¨⍳2⍴⍵}Jv	Mathematical	Pentadiagonal matrix of size Jv (n or m,n)		penta-diagonal banded	Dfn	Monadic Function	https://tio.run/##AS0A0v9hcGwtZHlhbG9n///ijpXihpB7MuKJpXwtL8Ko4o2zMuKNtOKNtX0gNiA3//8	
{3≥|-/¨⍳2⍴⍵}Jv	Mathematical	Heptadiagonal matrix of size Jv (n or m,n)		hepta-diagonal banded	Dfn	Monadic Function	https://tio.run/##AS0A0v9hcGwtZHlhbG9n///ijpXihpB7M@KJpXwtL8Ko4o2zMuKNtOKNtX0gNiA3//8	
{16⊥¯1+⍵⍳⍨⎕D,⎕A}Dv	Mathematical	Convert from hexadecimal		frombase16 base-16 ₁₆ hex2dec dec() Conversion converting change changing	Dfn	Monadic Function		
Mv{⌽+⌿↑⌽¨⍺ ⍵}Nv	Mathematical	Sum of polynomials with descending coefficients		additionof plus	Dfn	Dyadic Function		
Mv{⌽-⌿↑⌽¨⍺ ⍵}Nv	Mathematical	Difference between polynomials with descending coefficients		subtractionof minus	Dfn	Dyadic Function		
((⌽∨⊖)1∊¨⍳)Jv	Structural	All-zero matrix of shape Jv with ones along edges		all-around along outline frame table 1s zeroes 0s zeros in middle	Dfn	Monadic Function	https://tio.run/##AS8A0P9hcGwtZHlhbG9n///ijpXihpAgKCjijL3iiKjiipYpMeKIisKo4o2zKSA0IDX//w	
X(+/(∧\≡⍤¯1))Y	Comparison	Count number of leading major cells that match between two arrays of equal length		prefix matching onleft cells items start beginning equal	Dfn	Dyadic Function		
X(+/(∧\≢⍤¯1))Y	Comparison	Count number of leading major cells that differ between two arrays of equal length		prefix different onleft cells items start beginning unequal	Dfn	Dyadic Function		
Av{⍵⌷⍨⊂⍒+\⍺}Y	Index Generation	Reverse order of partitions in Y as indicated by Av (Fast ∊⌽Av⊂Yv)		quick speedy performance optimised optimized partitioned partitions segmented segments sub-vectors subvectors subarrays sub-arrays sub-lists sublists major cells downgrade descending	Dfn	Dyadic Function	https://tio.run/##SyzI0U2pTMzJT////1Hf1EdtExQMFQzA0BDKqn7Uu/VRz/ZHvSsedTU96p2kHfOod1etgnpiUnKKbkRklPr//wA	
Is{~0∊2</[⍺]⍵}N	Mathematical	Is N Strictly Increasing along axis Is?		testif ascending? rising? up ordered? sorted? dimension	Dfn	Dyadic Function		
Is{~0∊2≤/[⍺]⍵}N	Mathematical	Is N Non-decreasing along axis Is?		testif ascending? rising? up ordered? sorted? dimension	Dfn	Dyadic Function		
Is{~0∊2≥/[⍺]⍵}N	Mathematical	Is N Non-increasing along axis Is?		testif descending? falling? down ordered? Nonincreasing? sorted? dimension	Dfn	Dyadic Function		
Is{~0∊2>/[⍺]⍵}N	Mathematical	Is N Strictly Decreasing along axis Is?		testif descending? falling? down ordered? Nondecreasing? sorted? dimension	Dfn	Dyadic Function		
note←{new←⎕PW {old←⎕PW}} dfns.wrapnote note	Text	Wrap text paras in note vect		words linevector box-drawingcharacters boxdrawingcharacters string	Dfn	Function		https://dfns.dyalog.com/n_wrapnote.htm
{⍵ ⎕NPUT⍨⊂⎕SE⎕WG'Log'}Dv	System	Save Session log as file Dv		store dyalog transcript text scrollback scroll-back string	Dfn	Monadic Function		
X{0=40⎕ATX⍵:⍺ ⋄ ⍎⍵}Dv	System	Using default value X if Dv does not exist		fallback missing variable	Dfn	Dyadic Function		
Is{⍺↑⍵⍪⍺⌿¯1↑⍵}Y	Structural	Stretch Y to length Is repeating the last major cell as necessary		elongate continue final element item	Dfn	Dyadic Function		
{⍵/⍨~'  '⍷⍵}Dv	Text	Remove multiple blanks		consecutive spaces removing erasing erase eliminate eliminating delete deleting string	Dfn	Monadic Function	https://tio.run/##SyzI0U2pTMzJT////1Hf1EdtExSqH/Vu1X/Uu6JOXUFB/VHvdiC3VkHdM00BBPLzcioVPEGs7LzUcgWFjPxyhZJ8IDcFRBQU5RekFimU5xelAHnFBYnJmXnp6v//AwA	
Cv{≢⍺⎕S 3⍠'ML'1⊢⍵}Dv	Text	Does Dv have a match for regular expression Cv?		find has? match? contains? search testif string regex regexp	Dfn	Dyadic Function		
{(⍎⍵⎕NS⍬).⎕CY ⍵}Dv	System	Import workspace Dv into a namespace so an item can be called using wsname.name		load fetch get include from .dws	Dfn	Monadic Function		
{fns}←{space←⎕THIS} dfns.fnrepl (from to)	Text	Function string replacement		stringreplacement	Dfn	Function		https://dfns.dyalog.com/n_fnrepl.htm
{⎕D[1+⍉10⊥⍣¯1⊢⍵]}Jv	Data Representation	Zero-padded character matrix from vector of integers		rows with 0s zeroes zeros 0-padded fill	Dfn	Monadic Function	https://tio.run/##SyzI0U2pTMzJT////1Hf1EdtExSqgbRLtKH2o95OQ4NHXUsf9S4@tN7wUdeiR71bY2sVjA0VDBSMzA0t/v8HAA	
{⍵⌿⍨1,∨/2≢⌿⍵}Ym	Sets	Remove consecutive duplicate rows from ordered matrix Ym		table removing erasing erase eliminate eliminating delete deleting	Dfn	Monadic Function		
Is{⍺=-⍨/¨⍳2⍴⍵}Jv	Mathematical	Is-diagonal matrix of size Jv (n or m,n)		general k-diagonal	Dfn	Dyadic Function	https://tio.run/##ATMAzP9hcGwtZHlhbG9n///ijpXihpDCrzIge@KNuj0t4o2oL8Ko4o2zMuKNtOKNtX0gNiA3//8	
{⍵\⍨1 0⍴⍨⊃⌽⍴⍵}D	Text	Spacing out text		insert blanks expanded spaces string	Dfn	Monadic Function		
Av{⍵⌷⍨⊂⌽⍒+\⍺}Y	Structural	Reversal (⊖) of each subvector of Y indicated by Av (fast ∊⌽¨Av⊂Yv)		quick speedy performance optimised optimized partitioned partitions segmented segments sub-vectors subvectors subarrays sub-arrays sub-lists sublists reverse flip	Dfn	Dyadic Function		
X{⍺.##=⍵.##}Y	Systems	Are X and Y sibling objects?		testif siblings? sameparents	Dfn	Dyadic Function		
Is{⍵⌿⍨0=⍺|⍳≢⍵}Y	Selection	Taking every Is'th major cell of Y		nth element item	Dfn	Dyadic Function		
Is{⍵⌿⍨0≠⍺|⍳≢⍵}Y	Selection	Remove every Is'th cell of Y		filter item element removing erasing erase eliminate eliminating delete deleting	Dfn	Dyadic Function		
X{⍵⌿⍨⍺∊⍨⊣/⍵}Ym	Selection	Rows of non-empty matrix Y starting with an element in X		cell item table	Dfn	Dyadic Function		
Iv{⍵⌷⍨⊂⍺∪⍳≢⍵}Y	Structural	Move major cells at positions Iv to the front/top		index indices numbers bring promote element row item matrix table first	Dfn	Dyadic Function	https://tio.run/##SyzI0U2pTMzJT////1Hf1EdtExSMFYwUqh/1bn3Us/1R74pHXU2Penc96lj1qHfzo85FQPFaBXWP1JycfPX//wE	
Av{≠\⍵\⍺≠¯1↓0,⍺}Bv	Boolean/Logical	Compression vector Av for partitioned array indicated by Bv (Fast Av/⍨≢¨⊂⍨Bv)		quick speedy performance optimised optimized partitioned partitions segmented segments sub-vectors subvectors subarrays sub-arrays sub-lists sublists replicate generate produce construct argument	Dfn	Dyadic Function	https://tio.run/##SyzI0U2pTMzJT////1Hf1EdtExQMFQzAuPpR54KYR71bgXgXkHloveGjtskGOkBeLVjeAK4SiP//BwA	
Av{⍵[⍋⍺++\⍺]}Bv	Structural	1-rotate on each subvector of Bv indicated by Av (Fast ∊1⌽¨Av⊂Bv)		quick speedy performance optimised optimized partitioned partitions segmented segments sub-vectors subvectors subarrays sub-arrays sub-lists sublists rotating shifting cyclically	Dfn	Dyadic Function	https://tio.run/##SyzI0U2pTMzJT////1Hf1EdtExQMFQzAEEJXP@rdGv2ot/tR7y5t7RggGVuroJ6YlJzi6uau/v8/AA	
{⌊0.5+(!⍵)÷*1}N	Mathematical	Derangement		[n!/e] ⌊n!/e⌉ !n dn n¡ subfactorial deMontmort number	Dfn	Monadic Function		
{1 0 1(,∘.∧)⍣⍵⊢1}Js	Mathematical	Cantor set iteration Js		fractal ternary middle third iterate iterating	Dfn	Monadic Function		
X{⍵↓⍨-⊥⍨⍵∊⍺}Yv	Selection	Remove elements in X from end of vector Yv		trim trailing right cells items list ending removing erasing erase eliminate eliminating delete deleting	Dfn	Dyadic Function		
X{⍵↓⍨⊥⍨⌽⍵∊⍺}Yv	Selection	Remove elements in X from beginning of vector Yv		trim leading left cells items list start removing erasing erase eliminate eliminating delete deleting	Dfn	Dyadic Function		
{⍵/⍨∨⌿' '≠⍵}Dm	Text	Remove blank columns		all-space allspace empty remove delete drop space without removing erasing erase eliminate eliminating deleting string	Dfn	Monadic Function	https://tio.run/##SyzI0U2pTMzJT////1Hf1EdtExRyE0sUQLSRgsWj3i3qQFpBIVFBAUwCaXUuqLrqR71b9R/1rnjUseJRz351BfVHnQuAQrUgA/7/BwA	
{⍵⌿⍨∨/' '≠⍵}Dm	Text	Remove blank rows		all-space allspace empty remove delete drop space without removing erasing erase eliminate eliminating deleting string	Dfn	Monadic Function	https://tio.run/##SyzI0U2pTMzJT////1Hf1EdtExRyE0sUQLSFgtGj3i3qCgpGCkCQCESJIIY6F1Sduq4unF39qHfro579j3pXPOpYoa@uoP6ocwFQqBZk2P//AA	
{⌽@(1,≢⍵)⊢⍵}Y	Structural	Interchange first and last major cells		exchange swap head tail leading trailing elements items 1st start beginning ending	Dfn	Monadic Function		
Is{Y⌿⍨(⍋⍋⍵)∊⍺}Y	Selection	The Is smallest cells of Y in order of occurrence		least items elements	Dfn	Dyadic Function		
{⍵/⍨∨\⍵≠' '}Dv	Text	Remove leading blanks		remove delete spaces beginning start drop without removing erasing erase eliminate eliminating deleting string	Dfn	Monadic Function		
{⍵/⍨∨\⍵≠'0'}Dv	Text	Remove leading zeroes		remove zeros 0s trim left falses falsehoods start beginning removing erasing erase eliminate eliminating delete deleting string	Dfn	Monadic Function		
{⍵/⍨' '∨.≠⍵}Dm	Text	Remove blank columns		remove delete allspaces drop space without removing erasing erase eliminate eliminating deleting string	Dfn	Monadic Function		
{⍵⌿⍨' '∨.≠⍵}Dm	Text	Remove blank rows		remove delete allspaces emptylines drop space without removing erasing erase eliminate eliminating deleting string	Dfn	Monadic Function		
{(⎕NEW⊂'Clipboard').Text←⍵}D	System	Copy to Windows clipboard		cut put into	Dfn	Monadic Function		
{⍵⌷⍨⊂⍋⍒1 0⍴⍨≢⍵}Y	Structural	Perfect Ripple Shuffle		faro weave dovetail the technique zipper zipping merge merging interweave interweaving interleave interleaving shuffling meshing grade carddeck diversions riffleshuffle	Dfn	Function		
X(+/(∧\∘⌽≡⍤¯1))Y	Comparison	Count number of trailing major cells that match between two arrays of equal length		suffix matching onright cells items end equal	Dfn	Dyadic Function		
X(+/(∧\∘⌽≢⍤¯1))Y	Comparison	Count number of trailing major cells that differ between two arrays of equal length		suffix different onright cells items end unequal	Dfn	Dyadic Function		
Ms{¯2-/0,0⌈⍺-⍨+\⍵}Nv	Mathematical	FIFO stock Nv decremented by Ms		first-in-first-out warehouse	Dfn	Dyadic Function		
{,[¯1↓⍳≢⍴⍵]1/⍵}Y	Structural	Matricise (like ⍪ but preserves trailing instead of leading shape)		matrix table matrify Matricize start beginning ending	Dfn	Monadic Function		
(∪(⌿⍨)1≠⊢∘≢⌸)Y	Sets	Non-unique major cells		duplicated duplicates nonunique items elements	Dfn	Monadic Function	https://tio.run/##SyzI0U2pTMzJT////1Hf1EdtExQ0HnWs0njUs/9R7wpNw0edCx51LXrUMeNR56JHPTs0FdQTk4oSkxNTQJSi@v//AA	
{n=≢∪n|⍵+⍳n←≢⍵}Jv	Mathematical	Valid siteswap pattern?		testif juggling beat	Dfn	Monadic Function		
Is{p÷⍨⌊0.5+⍵×p←10*⍺}N	Mathematical	Rounding N to Is decimal places (Fast ⍎Is⍕N)		precision speed optimised optimized quick banking banker's bank's (⍎⍕)	Dfn	Dyadic Function		
{n⍪⍉↑⍵⍎¨n←⍵.⎕NL¯2}Ys	Data Conversion	Convert namespace of column vectors into table (matrix with names in header row)		headings labels object	Dfn	Monadic Function	https://tio.run/##SyzI0U2pTMzJT////1Hf1EdtExSq8x71rnrU2/mobeKj3q2PevsOrcgDigPZekAVfj6H1hvVKgBZXsH@furVSo7pqUpW0UpGhko6SsZGSrE6Sn6JuWAhp/wkoFhwYk5OJUg4KrMgOT8FLGNsYGhgBJQzMTYwMFSKrVX//x8A	
I{⍵⌷⍨⊂⍺~⍨⍳≢⍵}Y	Selection	Major cells of Y except those enumerated in I		without remove indices delete drop removing erasing erase eliminate eliminating deleting	Dfn	Dyadic Function		
Av{⍵⌷⍨⊂⍋⍺++\⍺}Y	Structural	Rotate first major cells (1⊖) of each subvector of Y indicated by Av (fast ∊1⌽¨Av⊂Yv)		quick speedy performance optimised optimized partitioned partitions segmented segments sub-vectors subvectors subarrays sub-arrays sub-lists sublists shift	Dfn	Dyadic Function		
I{⍵[⍋⍵[;⍺];]}Ym	Mathematical	Sort rows of matrix Ym according to column(s) I		sort() sortby() table sorting reordering ordering specific columns	Dfn	Dyadic Function		
Is{,⌿1+⍵⊤⍺?×/⍵}Jv	Index Generation	Deal: Is random items from ⍳Jv (without replacement)		distinct cells elements remove multi-dimensional high-rank indices removing erasing erase eliminate eliminating delete deleting	Dfn	Dyadic Function	https://tio.run/##SyzI0U2pTMzJT///qHeugnNOZnK2wqPmuY/6tyqU5Cukp@alFiWWpCrkpZYr5JXmJqUWFf9/1Df1UdsEBUNjhWqdRz37DbUf9W591LXkUe8u@8PT9YGcWhOg5P//AA	
svec←{shape←⍬⍴(⍴⍵)*÷2} dfns.sudoku prob	Mathematical	Solution vector for Sudoku problem ⍵		diversions gameofsudoku YouTube list	Dfn	Function		https://dfns.dyalog.com/n_sudoku.htm
{' '∧.=X←⍞:⍵ ⋄ X}Y	System	Return default value Y if input is empty		prompt fallback	Dfn	Monadic Function		
{⍵/⍨2∨/0,' '≠⍵}Dv	Text	Remove leading and multiple blanks		trim spaces left consecutive start beginning removing erasing erase eliminate eliminating delete deleting string	Dfn	Monadic Function	https://tio.run/##SyzI0U2pTMzJT////1Hf1EdtExQ0FKof9W7Vf9S7wuhRxwp9Ax11BfVHnQuAYrUK6gpg4JkGpvLzcioVPEGs7LzUcgWFjPxyhZJ8IDcFRBQU5RekFimU5xelAHnFBYnJmXnpIMXqCpo6Cup66v//AwA	
{⍵↓⍨-⊥⍨' '=⍵}Dv	Text	Remove trailing blanks		delete spaces drop ending without removing erasing erase eliminate eliminating deleting string	Dfn	Monadic Function		
defns←{names←0 {list←0 {space←⎕THIS}}} dfns.defs namelist	System	Extended ]defs		display latebinding ⎕NC	Dfn	Function		https://dfns.dyalog.com/n_defs.htm
X{r←⍵ ⋄ r←r⊣'r'⎕NS¨⍺}Ys	System	Merge members of namespaces X into namespace Ys		combine	Dfn	Dyadic Function		
{2⎕NQ⎕SE'FileRead'⊣⎕SE⎕WS'File'⍵}	System	Load Session configuration (including ]box and ]rows settings) from file Dv		RIDE get retrieve dyalog .dse restore settings ]boxing ]output.boxing ]output.rows	Dfn	Monadic Function		
{2⎕NQ⎕SE'FileWrite'⊣⎕SE⎕WS'File'⍵}Dv	System	Save Session configuration (including ]box and ]rows settings) as file Dv		RIDE put store dyalog .dse permanent keep settings ]boxing ]output.boxing ]output.rows make persistent	Dfn	Monadic Function		
{(∨\' '≠⍵)/⍵}Dv	Text	Fast: Dv without any leading blank spaces	Performance	speed optimised optimized quick trim left-align leftalign blanks start beginning remove removing erasing erase eliminate eliminating delete deleting idiom string	Dfn	Monadic Function		
Cv{⍺⎕S'&'⍠'OM'1⊢⍵}Dv	Text	Find all matches (even overlapping) for regex Cv in Dv		occurrences	Dfn	Dyadic Function	https://tio.run/##SyzI0U2pTMzJT////1Hf1EdtExTUE/XUFaof9e4C8oPV1dQf9S5Q9/dVN3zUtehR79ZaoHxSYmKy@v//AA	
Cv{⍺⎕S'%'⍠'ML'1⊢⍵}Dv	Text	grep: Globally search Dv with regular expression Cv and print first occurrence		find string regex regexp	Dfn	Dyadic Function		
{,⊃∘.+/⍵⍴⊂¯1+⍳10}Is	Mathematical	Sum of digits of the first 10*Is numbers		sod()	Dfn	Monadic Function		
Is{a[27|⍺+⍵⍳⍨a←27↑⎕A]}D	Text	Caesar's cipher for uppercase D (Is:encryption, -Is:decryption)		julius obfuscation obfuscate rotate rotation encrypting decrypting cypher shift code rot13 string	Dfn	Dyadic Function	https://tio.run/##SyzI0U2pTMzJT////1Hf1EdtExSMFaoTo43Max717tJ@1Lv1Ue/mR70rEoEyRuaP2iYCFTnG1iqoe7j6@Pirc0H1HFpPnC5vD3//IPX//wE	
Iv{⍺⌷⍨∘⊂⍨⍣⍵⍳≢⍺}Js	Index Generation	Permutation Iv to the power of Js		repeated	Dfn	Dyadic Function		
{(⊢÷⊃)⌽+\0,⍳⍵}Js	Mathematical	Outstanding balances on rule of 78s		sum-of-the-digits method	Dfn	Monadic Function		
Ms{⍵+.×⍨⍺*¯1+⍳≢⍵}Nv	Mathematical	Value of polynomial with coefficients Nv at point Ms			Dfn	Dyadic Function		
{⍵/⍨2∨/0,⍨' '≠⍵}Dv	Text	Remove multiple and trailing blanks		trim right consecutive spaces ending removing erasing erase eliminate eliminating delete deleting string	Dfn	Monadic Function	https://tio.run/##SyzI0U2pTMzJT////1Hf1EdtExSqH/Vu1X/Uu8LoUccKfQMdIEtdQf1R5wKgcK2CugIYeKaBqfy8nEoFTxArOy@1XEEhI79coSQfyE0BEQVF@QWpRQrl@UUpQF5xQWJyZl46SLH6//8A	
{⍵⌽⍨+/∧\' '=⍵}D	Text	Justifying left		leftalign left-align string	Dfn	Monadic Function		
Av{¯2-⌿0⍪(1⌽⍺)⌿+⍀⍵}N	Mathematical	Sum (+/) of each subvector of N indicated by Av (fast +/¨Av⊂Nv)		quick speedy performance optimised optimized partitioned partitions segmented segments sub-vectors subvectors subarrays sub-arrays sub-lists sublists major cells reduce reductions	Dfn	Dyadic Function		
Av{2=⌿1⍪(1⌽⍺)⌿=⍀⍵}B	Boolean/Logical	Reverse parity (=⌿) in each subvector of B as indicated by Av (fast =/¨Av⊂Bv)		quick speedy performance optimised optimized partitioned partitions segmented segments sub-vectors subvectors subarrays sub-arrays sub-lists sublists major cells reduce reductions	Dfn	Dyafic Function		
Av{2≠⌿0⍪(1⌽⍺)⌿≠⍀⍵}B	Boolean/Logical	Parity (≠⌿) in each subvector of B indicated by Av (fast ≠/¨Av⊂Bv)		quick speedy performance optimised optimized partitioned partitions segmented segments sub-vectors subvectors subarrays sub-arrays sub-lists sublists major cells reduce reductions	Dfn	Dyafic Function		
Ms{⍵×⍺÷⍵[⊃⍒|⍵]}Nv	Mathematical	Scale Nv so the maximum element is Ms		clamp rescale adjust largest highest biggest normalise normalize	Dfn	Dyadic Function	https://tio.run/##SyzI0U2pTMzJT////1Hf1EdtE0wVqh/1bj08/VHvrsPbgazoR13Nj3on1QCZsbUKh9YbAbHh//8A	
{⍵/⍨∨\' '∨.≠⍵}Dm	Text	Remove leading blank columns		remove delete allspaces drop start beginning space without removing erasing erase eliminate eliminating deleting string	Dfn	Monadic Function		
{⍵⌿⍨∨\⍵∨.≠' '}Dm	Text	Remove leading blank rows		remove delete allspaces drop start beginning space without removing erasing erase eliminate eliminating deleting string	Dfn	Monadic Function		
{⍵[⍋⍵+.≠' ';]}Dm	Text	Sorting words in list Dm according to word length		vector string	Dfn	Monadic Function		
Is{⍵⌿⍨(⍋⍒⍵)∊⍳⍺}Y	Selection	The Is largest cells of Y in order of occurrence		biggest greatestif items elements	Dfn	Dyadic Function		
{2∨/0,≠\⍵=''''}Dv	Text	Locations of texts between and including quotes		strings string	Dfn	Monadic Function		
{2∧/0,≠\⍵=''''}Dv	Text	Locations of texts between and excluding quotes		strings string	Dfn	Monadic Function		
Is{(-⍺)↑(99⍴1),⍴⍵}Y	Structural	Increase rank of Y to Is		number dimensions pad axes	Dfn	Dyadic Function		
Is{⍵⍪(⍺-≢⍵)⌿¯1↑⍵}Y	Structural	Extending Y with last cell of Y to length Is		filling enlongating item element	Dfn	Dyadic Function		
X{⍺⌿⍨(≢⍵)≥⍵⍳⍺}Y	Sets	Intersection (∩) on major cells for any rank		setand higher high-rank any-rank highrank anyrank items elements	Dfn	Dyadic Function		
Cv{~⍺'$'⎕S 3⍠'ML'1⊢⍵}Dv	Text	Indicate which lines of Dv have a match for regular expression Cv		find has? match? contains? search testif string regex regexp mask Boolean	Dfn	Dyadic Function	https://tio.run/##SyzI0U2pTMzJT////1Hf1EdtExTU9fLVFarrHvXuUldRB4oFKxg/6l2g7uujbvioa9Gj3q21CuoeqTk5QFXq5flFOSlAOiO/HEgmFqUCycr8UvX//wE	
{⍵⌷⍨⊂0~⍨⊢/0,⊢⌸⍵}Y	Set	Modes: most frequently occuring major cells		items elements	Dfn	Monadic Function		
kmap←{xk←(⊂,⊂∘kind)⎕NL-⍳10} dfns.kk fnop	Text	Kind Koloring of d-fnop named ⍵		namecolouring coloring Kolouring parsing Bunda-Gerthparser polymorphism selfie BundaGerthparser coloring tokens types syntax syntactic string	Dfn	Function		https://dfns.dyalog.com/n_kk.htm
{0::⎕DMX⊣⎕DMX.(⎕EX⎕NL)2 ⋄ .}Y	System	New root namespace (Y is ignored)		own parent ancestor self-contained	Dfn	Monadic Function		
Iv{⍵/⍨~⍺∊⍨⍳⊃⌽⍴⍵}Y	Selection	Remove columns Iv from array Y		except without butnot remove removing erasing erase eliminate eliminating delete deleting	Dfn	Dyadic Function		
Av{⍵⌷⍨⊂1⌈⌈\⍺×⍳≢⍺}Y	Selection	Copying each cell of Y until before next 1 in Av		item element	Dfn	Dyadic Function		
Mv{⍺+2-⌿⌈⍀0⍪+⍀⍺-⍵}Nv	Mathematical	Work done for demand N with capacity M		orders capacities production supply demands supplies	Dfn	Dyadic Function		
{(⎕D,⎕A)[1+16⊥⍣¯1⊢⍵]}Js	Mathematical	Convert to hexadecimal		tobase16 base-16 ₁₆ dec2hex hex() Conversion converting change changing	Dfn	Monadic Function		
A{m+⍺⌈.×⍨⍵-m←⌊/⍵}Nv	Mathematical	Maxima of elements of subsets of Nv specified by A (one mask per column)		major cells items indicate masking indicating bitmask bit-mask	Dfn	Dyadic Function		
Xv{⊃⍪/1↓,(⊂⍺),⍪⍵}Yv	Structural	Join vector of vectors Yv using separator Xv		text with using strings list joiner combiner joining combining merge merging string	Dfn	Dyadic Function		
Is{1↓⍵/⍨⍺=+\⍵=⊃⍵}Yv	Selection	The Is'th subvector of Yv (subvectors separated by Yv[1])			Dfn	Dyadic Function		
Is{1↓⍵/⍨⍺=+\⍵=⊃⍵}Dv	Text	Extracting field number Is from Dv (field separated by first element of Dv)		select pick partitionedvector segmentedstring index cell item 1st string	Dfn	Dyadic Function		
Ms{⍺←0 ⋄ ⍺,⍨⍵÷⌽⍳≢⍵}Nv	Mathematical	Integral of polynomial Nv with descending coefficients and optional constant Ms		firstintegral integrate	Dfn	Ambivalent Monadic Function, Dyadic Function		
Xv{(⊂⍺)∊⌽∘⍵¨⍳≢⍵}Yv	Comparison	Are circular lists Xv and Yv identical (excluding phase)		testif vectors same? equivalent? equal?	Dfn	Dyadic Function		
Ms{⍵⍀⍨(⌈⍺)≠⍳1+≢⍵}Y	Structural	Adding an empty cell into Y at fractional position Ms		expand insert item element	Dfn	Monadic Function		
Is{(+/[⍺]÷⍺⊃⍴)⍵}N	Mathematical	Average (mean value) of elements of N along direction Is		arithmeticmean() AM() avg() axis dimension cells items	Dfn	Monadic Function		
Av{⍵[⍋(+\⍺)-1⌽⍺]}Bv	Structural	¯1-rotate on each subvector of Bv indicated by Av (Fast ∊¯1⌽¨Av⊂Bv)		quick speedy performance optimised optimized partitioned partitions segmented segments sub-vectors subvectors subarrays sub-arrays sub-lists sublists rotating shifting cyclically	Dfn	Dyadic Function	https://tio.run/##SyzI0U2pTMzJT////1Hf1EdtExQMFQzAEEJXP@rdGv2ot1tDO@ZR7y5NXcNHPXuBjNhaBfXEpOQUVzd39f//AQ	
I{(1++\' '=⍵)[⍺]}Dv	Index Generation	Ordinal numbers of words in Dv that indices I point to		which	Dfn	Dyadic Function		
I{⍉2⊥∨/2⊥⍣¯1⍉⍺,[0.5]⍵}J	Boolean/Logical	Bit-wise OR for positive integers		bitwise binary gate disjunction vel alternation Apq	Dfn	Dyadic Function		
I{⍉2⊥∧/2⊥⍣¯1⍉⍺,[0.5]⍵}J	Boolean/Logical	Bit-wise AND for positive integers		bitwise binary gate conjunction Kpq	Dfn	Dyadic Function		
I{⍉2⊥</2⊥⍣¯1⍉⍺,[0.5]⍵}J	Boolean/Logical	Bit-wise converse nonimplication for positive integers		bitwise binary gate Mpq cnimply	Dfn	Dyadic Function		
I{⍉2⊥≤/2⊥⍣¯1⍉⍺,[0.5]⍵}J	Boolean/Logical	Bit-wise implication for positive integers		bitwise binary gate materialconditional materialconsequence implies implying materialimplication therefore Cpq	Dfn	Dyadic Function		
I{⍉2⊥=/2⊥⍣¯1⍉⍺,[0.5]⍵}J	Boolean/Logical	Bit-wise XNOR for positive integers		bitwise binary gate materialbiconditional biimplication eqv nxor bothorneither both-or-neither exclusivenor materialequivalence Kroneckerdelta iff logicalequivalence Epq doubleimplying	Dfn	Dyadic Function		
I{⍉2⊥≥/2⊥⍣¯1⍉⍺,[0.5]⍵}J	Boolean/Logical	Bit-wise converse implication for positive integers		bitwise binary gate because if converseconditional Bpq reverseimplying cimply	Dfn	Dyadic Function		
I{⍉2⊥>/2⊥⍣¯1⍉⍺,[0.5]⍵}J	Boolean/Logical	Bit-wise nonimplication for positive integers		bitwise binary gate abjunction not butnot Lpq nimply	Dfn	Dyadic Function		
I{⍉2⊥≠/2⊥⍣¯1⍉⍺,[0.5]⍵}J	Boolean/Logical	Bit-wise XOR for positive integers		bitwise binary gate exclusivedisjunction eor exor Jpq	Dfn	Dyadic Function		
I{⍉2⊥⍱/2⊥⍣¯1⍉⍺,[0.5]⍵}J	Boolean/Logical	Bit-wise NOR for positive integers		bitwise binary gate peirce'sarrow quine'sdagger ampheck neithernor neither-nor jointdenial Xpq	Dfn	Dyadic Function		
I{⍉2⊥⍲/2⊥⍣¯1⍉⍺,[0.5]⍵}J	Boolean/Logical	Bit-wise NAND for positive integers		bitwise binary gate shefferstroke notand alternativedenial Dpq	Dfn	Dyadic Function		
Ns{+/⍵××\1,⍺÷⍳¯1+≢⍵}Nv	Mathematical	Value of Taylor series with coefficients Nv at point Ns			Dfn	Dyadic Function		
Av{≠⍀b⍀2≠⌿0⍪⍵⌿⍨b←⍺∨⍵}Bv	Boolean/Logical	Not leading zeroes (∨\) in each subvector of Bv indicated by Av (fast ∊∨\¨Av⊂Nv)		quick speedy performance optimised optimized partitioned partitions segmented segments sub-vectors subvectors subarrays sub-arrays sub-lists sublists zeros 0s falses falsehoods start beginning scan	Dfn	Dyadic Function		
{1↓∊':'@1∘⍕¨100+3↑3↓⍵}Jv	Text	Date (⎕TS format) to hh:mm:ss		timestamp 24-hour clock string	Dfn	Monadic Function		
Mv{¯2-⌿0⍪(2≠/⍺⍪0)⌿+⍀⍵}Nv	Mathematical	Sum elements of Nv marked by successive identicals in Mv		partitioned segmented major cells items	Dfn	Dyadic Function		
