SYNTAX	CATEGORY	DESCRIPTION	GROUP	KEYWORDS	CLASS	TYPE	TIO	DOCS
)ED ∇ nms	System Command	Create one or more functions (nms) in the Editor		creating new definition define value ⎕ed	Non-syntax			https://help.dyalog.com/latest/#Language/System%20Commands/ed.htm
)ED → nms	System Command	Create one or more character vectors (nms) in the Editor		string creating new definition define value ⎕ed text	Non-syntax			https://help.dyalog.com/latest/#Language/System%20Commands/ed.htm
X f(DOP Z)Y	Expression	Dyadic operator (DOP) taking an array operand (W) to derive a monadic operator (which in turn takes a function operand to derive a dyadic function)	Dyadic Operator	currying derived binding	Syntax	Dyadic Function		https://help.dyalog.com/latest/#Language/Introduction/Binding%20Strength.htm
X f(DOP g)Y	Expression	Dyadic operator (DOP) taking a function operand to derive a monadic operator (which in turn takes a function operand to derive a dyadic function)	Dyadic Operator	currying derived binding	Syntax	Dyadic Function		https://help.dyalog.com/latest/#Language/Introduction/Binding%20Strength.htm
X (Y Z)	Expression	Stranding: (⊂X),⊂(⊂Y),(⊂Z)		roundparentheses roundparens grouping nestedarraynotation nestedvectornotation	Syntax			https://help.dyalog.com/latest/#Language/Introduction/Variables/Vector%20Notation.htm
X(Z g h)Y	Expression	Fork (E-combinator): Z g X h Y	Train	Eagle-bird pointwise tacit roundparentheses roundparens grouping derived Agh 3train 3-train	Syntax	Dyadic Function		https://help.dyalog.com/latest/#Language/Introduction/Trains.htm
X(f g h)Y	Expression	Fork (Φ₁-combinator): (X f Y)g(X h Y)	Train	Golden-Eagle-bird Goldeneagle-bird E-hat-combinator Ehat-combinator pointwise tacit roundparentheses roundparens grouping derived fgh 3train 3-train	Syntax	Dyadic Function		https://help.dyalog.com/latest/#Language/Introduction/Trains.htm
X(f g)Y	Expression	Atop (B₁-combinator): f X g Y	Train	Blackbird-bird B1-combinator tacit roundparentheses roundparens grouping derived fg 2train 2-train	Syntax	Dyadic Function		https://help.dyalog.com/latest/#Language/Introduction/Trains.htm
W(DOP Z)Y	Expression	Dyadic operator (DOP) taking an array operand (W) to derive a monadic operator (which in turn takes a function operand to derive a monadic function)	Dyadic Operator	currying derived binding	Syntax	Monadic Function		https://help.dyalog.com/latest/#Language/Introduction/Binding%20Strength.htm
W(DOP g)Y	Expression	Dyadic operator (DOP) taking a function operand to derive a monadic operator (which in turn takes an array operand to derive a monadic function)	Dyadic Operator	currying derived binding	Syntax	Monadic Function		https://help.dyalog.com/latest/#Language/Introduction/Binding%20Strength.htm
f(DOP Z)Y	Expression	Dyadic operator (DOP) taking an array operand (W) to derive a monadic operator (which in turn takes an array operand to derive a monadic function)	Dyadic Operator	currying derived binding	Syntax	Monadic Function		https://help.dyalog.com/latest/#Language/Introduction/Binding%20Strength.htm
f(DOP g)Y	Expression	Dyadic operator (DOP) taking a function operand to derive a monadic operator (which in turn takes a function operand to derive a monadic function)	Dyadic Operator	currying derived binding	Syntax	Monadic Function		https://help.dyalog.com/latest/#Language/Introduction/Binding%20Strength.htm
(X g h)Y	Expression	Fork (D-combinator): X g h Y	Train	Dove-bird pointwise tacit roundparentheses roundparens grouping derived Agh 3train 3-train	Syntax	Monadic Function		https://help.dyalog.com/latest/#Language/Introduction/Trains.htm
(f g h)Y	Expression	Fork (Φ-combinator): (f Y)g(h Y)	Train	Phoenix-bird S′-combinator pointwise tacit roundparentheses roundparens grouping derived fgh 3train 3-train	Syntax	Monadic Function		https://help.dyalog.com/latest/#Language/Introduction/Trains.htm
(f g)Y	Expression	Atop (B-combinator): f g Y	Train	Bluebird-bird tacit roundparentheses roundparens grouping derived fg 2train 2-train	Syntax	Monadic Function		https://help.dyalog.com/latest/#Language/Introduction/Trains.htm
0=⍴⍴Y	Array Properties	Fast: Is Y a Scalar?	Performance	testif speed optimised optimized quick idiom	Expression			
1=≡,Y	Array Properties	Fast: Is Y a Simple Array?	Performance	testif speed optimised optimized quick simple? idiom flat?	Expression			
0=⊃⍴Y	Array Properties	Fast: Does Y have an empty first dimension?	Performance	testif speed optimised optimized quick empty? norows? 1st idiom	Expression			
⊃⌽,Y	Selection	Fast: The item in the bottom right of Y	Performance	speed optimised optimized quick last bottom-right southeast south-east cell element idiom	Expression			
M⊃¨⊂Yv	Selection	Fast: The subset of Yv in the index positions defined by M (equivalent to Yv[M])	Performance	speed optimised optimized quick chipmunk selectfrom indexinto idiom	Expression			
Av/⍳⍴Yv	Index Generation	Fast: The positions in Yv corresponding to the 1s in Av	Performance	speed optimised optimized quick ones where trues truths idiom	Expression			
~0∊⍴Y	Array Properties	Fast: Is Y non-empty?	Performance	testif speed optimised optimized quick nonempty? hascontent? idiom	Expression			
;X;Y;Z	Definition	Tradfn/Tradop locals line localisation of names X, Y, Z (before first code)		localization shadow variables symbols identifiers scope stack frame scope localise localize declaration declare declaring 1st lines	Syntax			https://help.dyalog.com/latest/#Language/Defined%20Functions%20and%20Operators/TradFns/Locals%20Lines.htm
]name -?		Print help for user command 'name'		rightsquarebracket rightbracket usercommand ucmd documentation instructions	Non-syntax		https://tio.run/##SyzI0U2pTMzJT////1HfVOdI9eLEnBJ1hUfdLQqpeYlJOanBjj4h///HpiUml@QXFSvo2gMA	https://help.dyalog.com/latest/#UserGuide/The%20APL%20Environment/User%20Commands.htm
↓⍉↑Yv	Structural	Fast: A nested vector comprising vectors that each correspond to a position in the original vectors of Yv – the first vector contains the first item from each vector in Yv, padded to be the same length as the largest vector, and so on	Performance	speed optimised optimized quick transpose transposing vtv cell element 1st lists zip() remixing zipping merging interweave interweaving interleave interleaving shuffle shuffling meshing idiom zip zipwith() zip-with zipwith	Expression			
⌊0.5+N	Mathematical	Fast: Round to nearest integer	Performance	speed optimised optimized quick int() idiom	Expression			
...	System	Syntax error to stop execution		halt	Non-syntax			
⎕NL-⍳9		List names of existing members	Workspace	available active names namelist all types nameclasses name-classes everything	Expression		https://tio.run/##SyzI0U2pTMzJT////1Hf1EdtExSAVLCrHpD089F91LvZ8v9/AA	https://help.dyalog.com/latest/#Language/System%20Functions/nl.htm
31↓⎕UCS⍳126	Text	Printable ASCII		characters string	Constant	Expression	https://tio.run/##SyzI0U2pTMzJT////1Hf1EdtExSMDR@1TQayQ52DH/VuNjQy@/8fAA	
⎕SE.Dyalog.Serial Y	System	Set or query (if Y is empty) serial number		report license licence licensing licencing get fetch renew initialise initialize serialnumber account dss+ unregistered unregistration deregistered deregistration	Tradfn	Monadic Function		
name f∘⊢←Y	Expression	Modified Assignment (also dfns/dops)	Monadic Operator	leftarrow gets is copula let redefine naming denotes means inplace update			https://tio.run/##SyzI0U2pTMzJT///3y0//1HbhGouBSBIBLIe9W4Fs5OgbDAnIKe0GMjXhvASIfyOGY@6FgFFDSHqYYoMYYqSuGq5HvVNBQoB7VAw/v8fAA	https://help.dyalog.com/latest/#Language/Primitive%20Operators/Assignment%20Modified.htm
⎕THIS.name←Y	Expression	Assign (in dfns/dops) to closest scope where localised or in global scope if not localised anyhere		new assignment assigning value variable function operator out-of-scope don't no shadowing defeating circumventing auto-shadowed auto-localise auto-localize auto-localising auto-localizing allocation allocated semi-global name∘←Y Mike Day's strange device excalibur	Syntax			
:Include <ns>	Expression	Import methods from one a namespace to this class	Keyword	import copy into functions operators members library libraries	Syntax	Control		https://help.dyalog.com/latest/#Language/Object%20Oriented%20Programming/Including%20Namespaces%20in%20Classes.htm
35::FILE ACCESS ERROR - CONVERTING FILE	Error Message	Operating system did not allow APL to upgrade component file structure		trap catch errno Conversion change changing				https://help.dyalog.com/latest/#Language/Errors/FILE%20ACCESS%20ERROR%20CONVERTING.htm
60::FULL-SCREEN ERROR	Error Message	The required full screen capabilities are not available to ⎕SM		trap catch errno				https://help.dyalog.com/latest/#Language/Errors/FULL%20SCREEN%20ERROR.htm
56::FIELD CONTENTS/TYPE MISMATCH	Error Message	Field contents assigned to ⎕SM does not conform with the given field type e.g. character content with numeric type		trap catch errno				https://help.dyalog.com/latest/#Language/Errors/FIELD%20CONTENTS%20TYPE%20MISMATCH.htm
57::FIELD TYPE/BEHAVIOUR UNRECOGNISED	Error Message	Field type or behaviour code assigned to ⎕SM is invalid		trap catch errno behavior				https://help.dyalog.com/latest/#Language/Errors/FIELD%20TYPE%20BEHAVIOUR%20UNRECOGNISED.htm
X[Iv Jv …]	Selection	Indexing (scatter-point)		squarebrackets subscript choose move reorder	Syntax	Dyadic Function		https://help.dyalog.com/latest/#Language/Primitive%20Functions/Indexing.htm
0(220⌶)Jv	Data Conversion	Deserialise Array		serialising serializing serialisation serialization serialize ibeam fromsint signed integer representation converting change changing	I-beam	Function	https://tio.run/##SyzI0U2pTMzJT////1Hf1EdtE4qB2FDDyMjgUc82TSMFo0e9W4wUzBUMFSy4IAoMYJLF//8DAA	https://help.dyalog.com/latest/#Language/I%20Beam%20Functions/Serialise%20Array.htm
0(7162⌶)Dv	Data Conversion	Translate JSON name to valid APL name (mangle if necessary)		serialise serialize serialisation serialization serialising serializing ⍙ representation identifier ⎕json namemangling ibeam mangled converting change changing	I-beam	Function	https://tio.run/##SyzI0U2pTMzJT////1Hf1EdtEww0zA3NjB71bNNUT0xK1q2orFL//x8A	https://help.dyalog.com/latest/#Language/I%20Beam%20Functions/JSON%20Translate%20Name.htm
0(85⌶)Dv	Data Conversion	Execute expression Dv (⍎Dv) and signal ERROR 85 if it has no result, otherwise return result		eval() evaluate apl compute run call parseexpression noresult ibeam no-result missing unshy un-shy converting change changing	I-beam	Dyadic Function	https://tio.run/##SyzI0U2pTMzJT/8PBAYaFqaPerZpqptoG6lzwXmJj9omGCLxq2uN1QE	https://help.dyalog.com/latest/#Language/I%20Beam%20Functions/Execute%20Expression.htm
1(220⌶)Y	Data Conversion	Serialise Array		serialising serializing serialisation serialization serialize ibeam tosint signed integer representation converting change changing	I-beam	Function	https://tio.run/##SyzI0U2pTMzJT////1Hf1EdtE4qB2FDDyMjgUc82TSMFo0e9W4wUzBUMFSy4IAoMYJLF//8DAA	https://help.dyalog.com/latest/#Language/I%20Beam%20Functions/Serialise%20Array.htm
1(7162⌶)Dv	Data Conversion	Translate possibly mangled APL name to JSON name (demangle if mangled)		deserialise deserialize deserialisation deserialization deserialising deserializing ⍙ representation identifier ⎕json namemangling ibeam demangled converting change changing	I-beam	Function	https://tio.run/##SyzI0U2pTMzJT////1Hf1EdtEww1zA3NjB71bNNUf9Q7MzEpGUiamAKJisoq9f//AQ	https://help.dyalog.com/latest/#Language/I%20Beam%20Functions/JSON%20Translate%20Name.htm
1(85⌶)Dv	Data Conversion	Execute expression Dv (⍎Dv) and signal ERROR 85 if result is shy or missing, otherwise return result		eval() evaluate apl compute run call parseexpression noresult ibeam no-result converting change changing	I-beam	Dyadic Function	https://tio.run/##SyzI0U2pTMzJT/8PBIYaFqaPerZpqptoG6lzwXmJj9omGKoDAA	https://help.dyalog.com/latest/#Language/I%20Beam%20Functions/Execute%20Expression.htm
Xv(8⌶)Yv	Index Generation	Inverted Table Index-of (Xv⍳Yv)		iota indicesin indexof position columndatabase matrix ibeam	I-beam	Dyadic Function		https://help.dyalog.com/latest/#Language/I%20Beam%20Functions/Inverted%20Table%20Index%20Of.htm
X(1159⌶)Y	System	Update Function Time and User Stamp		⎕at properties operator ibeam	I-beam	Function		https://help.dyalog.com/latest/#Language/I%20Beam%20Functions/Update%20Function%20Timestamp.htm
Mv(16808⌶)Dv Jv	Mathematical	Sample Probability Distribution: Random array of shape Jv with distribution Dv and parameters Mv	Monadic Operator	prng uniform U(a,b) beta bernoulli binomial Lorentz-cauchy lorentzian function breit-wigner chi-squared χ²-distribution exponential Fisher-Snedecor's F-distribution F-ratio gamma Γ inverse-gamma inv-gamma inv-Γ log-normal lognormal galton's laplace-gaussian poisson student-t student's t-distribution weibull	I-beam	Dyadic Function		https://help.dyalog.com/latest/#Language/I%20Beam%20Functions/Sample%20Probability%20Distribution.htm#Sample_Probability_Distribution
Mv(219⌶)Jv	Data Conversion	Compress/Decompress Vector of Short Integers		lz4 zlib gzip unzip deflate deflation uncompression inflate inflation list ibeam converting change changing	I-beam	Function		https://help.dyalog.com/latest/#Language/I%20Beam%20Functions/Compress%20Vector%20of%20Short%20Integers.htm
Is(1500⌶)Y	Array Properties	Hash Array		performance hasharray hash-array hash-table	I-beam	Function		https://help.dyalog.com/latest/#Language/I%20Beam%20Functions/Hash%20Array.htm
Is(86⌶)Dv	Data Conversion	Execute expression Dv (⍎Dv) but Is frames up the stack (unofficial)		eval() evaluate apl compute run call parseexpression noresult ibeam in different stack-frames stackframes converting change changing	I-beam	Dyadic Function	https://tio.run/##SyzI0U2pTMzJT///3y0//1HbhGr3/HyFR71rarncIXxDDQuzRz3bNNUf9W5Vr@V61DcVKApUq2Bi9P8/AA	
Is(8659⌶)Jv	System	List names (of name classes Jv) for share code file in slot Is	Monadic Operator	report workspace	I-beam	Dyadic Function		https://docs.dyalog.com/latest/Shared%20Code%20Files%20User%20Guide.pdf
Iv(2000⌶)Jv	System	Memory Manager Statistics		management performance ibeam	I-beam	Function		https://help.dyalog.com/latest/#Language/I%20Beam%20Functions/Memory%20Manager%20Statistics.htm
Iv(8666⌶)Dv	System	Attach shared code file Dv (for name classes Iv)	Monadic Operator	attaching to workspace	I-beam	Dyadic Function		https://docs.dyalog.com/latest/Shared%20Code%20Files%20User%20Guide.pdf
Cv(1200⌶)N	Text	Format date-time	Monadic Operator	string	I-beam	Dyadic Function		https://help.dyalog.com/latest/#Language/I%20Beam%20Functions/Format%20Datetime.htm
{X}2011⌶Y	System	Read DataTable	Monadic Operator	ADO.NET object blockread System.Data.DataTable	I-beam	Ambivalent Monadic Function, Dyadic Function		https://help.dyalog.com/latest/#Language/I%20Beam%20Functions/Read%20DataTable.htm#ReadDataTable
20⎕DT'Z'	Data Conversion	Current UNIX time		now datetime zulutime zulu-time UnixTime PosixTime UnixEpochTime 1970	Constant	Expression		
¯1⎕DT'Z'	Data Conversion	Current UTC date and time		now datetime zulutime zulu-time	Constant	Expression		
(name1 name2)←Y	Expression	Multiple assignment		leftarrow get are copula let define list naming denote mean unpacking distributing distribution vector distributed pervasive pervading pervade unpacking unpacked			https://tio.run/##SyzI0U2pTMzJT///XyNRIUnzUdsEQwUjrkd9U4EshUTtpP//AQ	https://help.dyalog.com/latest/#Language/Introduction/Namespaces/Distributed%20Assignment.htm
(name1 name2)←name2 name1	Expression	Swap variable values		leftarrow get are copula let redefine redefining list renaming denote mean unpacking redistributing redistribution vector exchange exchanging swapping variables			https://tio.run/##SyzI0U2pTMzJT///XyNRIUnzUdsEUwULLhg7SSGR61HfVCBLIVE36f9/AA	https://help.dyalog.com/latest/#Language/Introduction/Namespaces/Distributed%20Assignment.htm
:Attribute name {ConstructorArgs}	Expression	Descriptive tag that provides additional information to .NET	Keyword	declaration declare oo objectorientation metadata	Syntax	Control		https://help.dyalog.com/latest/#Language/Control%20Structures/attribute.htm
∇ X(f op g)Y	Definition	Dyadic tradop header for deriving dyadic functions	Dyadic Operator	declaration [0] declaring defining	Syntax	Dyadic Function		https://help.dyalog.com/latest/#Language/Defined%20Functions%20and%20Operators/TradFns/Model%20Syntax.htm
∇ X(f op)Y	Definition	Monadic tradop header for deriving dyadic functions	Monadic Operator	declaration [0] declaring defining	Syntax	Dyadic Function		https://help.dyalog.com/latest/#Language/Defined%20Functions%20and%20Operators/TradFns/Model%20Syntax.htm
∇ f(X Y Z)	Definition	Tradfn/Tradop right argument name list (enforces correct number of arguments and distributes values)		declaration [0] declaring defining names unpacking vector header	Syntax			https://help.dyalog.com/latest/#Language/Defined%20Functions%20and%20Operators/TradFns/Namelists.htm
∇ {X}f Y	Definition	Optional Left Tradfn/Tradop Argument		curlybraces function operator default ambivalent variadic traditional ambivalence header	Syntax			https://help.dyalog.com/latest/#Language/Defined%20Functions%20and%20Operators/TradFns/Model%20Syntax.htm
∇ (f op g)Y	Definition	Dyadic tradop header for deriving monadic functions	Dyadic Operator	declaration [0] declaring defining	Syntax	Monadic Function		https://help.dyalog.com/latest/#Language/Defined%20Functions%20and%20Operators/TradFns/Model%20Syntax.htm
∇ (f op)Y	Definition	Monadic tradop header for deriving monadic functions	Monadic Operator	declaration [0] declaring defining	Syntax	Monadic Function		https://help.dyalog.com/latest/#Language/Defined%20Functions%20and%20Operators/TradFns/Model%20Syntax.htm
)XLOAD {ws}	System Command	Load workspace ws without executing ⎕LX	File Access	silent quiet still norun non-⎕LX )load prevent open fetch get quiet latentexpression autoexec boot	Non-syntax			https://help.dyalog.com/latest/#Language/System%20Commands/xload.htm
)METHODS {nm}	System Command	List methods in current namespace, optionally beginning with {nm}		information listing report ¯3.6 vector start leading	Non-syntax			https://help.dyalog.com/latest/#Language/System%20Commands/methods.htm
)NS {name}	System Command	Create new global namespace called name		⎕NS	Non-syntax			https://help.dyalog.com/latest/#Language/System%20Commands/ns.htm
)INTERFACES {nm}	System Command	List interfaces in current namespace, optionally beginning with {nm}		information listing report ¯9.5 ¯9.7 vector start leading	Non-syntax			https://help.dyalog.com/latest/#Language/System%20Commands/interfaces.htm
)CLASSES {nm}	System Command	List classes in current namespace, optionally beginning with {nm}		information listing report ¯9.4 vector start leading	Non-syntax			https://help.dyalog.com/latest/#Language/System%20Commands/classes.htm
)COPY ws {nms}	System Command	Copy (selected) contents of workspace ws to active workspace	File Access	import use load transfer include items otherworkspace )pcopy ⎕cy functions variables operators namespaces GUI objects classes interfaces instances	Non-syntax			https://help.dyalog.com/latest/#Language/System%20Commands/copy.htm
)CS {space}	System Command	Change current namespace		navigate enter into out of # ⎕se ⎕cs changing	Non-syntax			https://help.dyalog.com/latest/#Language/System%20Commands/cs.htm
)DROP {ws}	System Command	Erase file containing workspace ws		delete remove expunge without removing erasing eliminate eliminating deleting	Non-syntax			https://help.dyalog.com/latest/#Language/System%20Commands/drop.htm
)ED {etype} nms	System Command	Open one or more objects (nms) of types etypes in the Editor		create creating modify code source definition define value ⎕ed	Non-syntax			https://help.dyalog.com/latest/#Language/System%20Commands/ed.htm
)EVENTS {nm}	System Command	List events in current namespace, optionally beginning with {nm}		information listing report ¯8.6 vector start leading	Non-syntax			https://help.dyalog.com/latest/#Language/System%20Commands/events.htm
)FNS {nm}	System Command	List functions in current namespace, optionally beginning with {nm}		information listing report ¯3.1 ¯3.2 ¯3.3 ¯3.6 vector start leading	Non-syntax			https://help.dyalog.com/latest/#Language/System%20Commands/fns.htm
)LIB {folder}	System Command	List workspaces either on WSPATH or in folder		dir ls vector	Non-syntax			https://help.dyalog.com/latest/#Language/System%20Commands/lib.htm
)LOAD {ws}	System Command	Replace active workspace with workspace ws	File Access	open fetch get bringin ⎕load	Non-syntax			https://help.dyalog.com/latest/#Language/System%20Commands/load.htm
)OBJECTS {nm}	System Command	List objects in current namespace, optionally beginning with {nm}		information listing report ¯9.1 ¯9.2 ¯9.4 ¯9.5 ¯9.6 ¯9.7 vector start leading	Non-syntax			https://help.dyalog.com/latest/#Language/System%20Commands/objects.htm
)OBS {nm}	System Command	List objects in current namespace, optionally beginning with {nm}		information listing report ¯9.1 ¯9.2 ¯9.4 ¯9.5 ¯9.6 ¯9.7 vector start leading	Non-syntax			https://help.dyalog.com/latest/#Language/System%20Commands/obs.htm
)OPS {nm}	System Command	List operators in current namespace, optionally beginning with {nm}		information listing report ¯4.1 ¯4.2 ¯4.3 vector start leading	Non-syntax			https://help.dyalog.com/latest/#Language/System%20Commands/ops.htm
)PCOPY ws {nms}	System Command	As )COPY but does not overwrite existing objects	File Access	import load include item otherworkspace cell element	Non-syntax			https://help.dyalog.com/latest/#Language/System%20Commands/pcopy.htm
)PROPS {nm}	System Command	List properties in current namespace, optionally beginning with {nm}		information listing report ¯2.3 vector start leading	Non-syntax			https://help.dyalog.com/latest/#Language/System%20Commands/props.htm
)RESET {n}	System Command	Reset state indicator, empty event queue/clear top n suspensions, and close corresponding trace windows (synonym of )SIC)		debugging session terminate quit leave eliminate cutback exit tracing stack debugger tracer tracing	Non-syntax			https://help.dyalog.com/latest/#Language/System%20Commands/reset.htm
)SIC {n}	System Command	Stack Indicator Clear: Reset state indicator, empty event queue/clear top n suspensions, and close corresponding trace windows (synonym of )RESET)		debugging session terminate quit leave eliminate cutback exit tracing stack debugger tracer tracing	Non-syntax			https://help.dyalog.com/latest/#Language/System%20Commands/sic.htm
)TID {tdno}	System Command	Switch to thread tdno or report current thread number		synchronisation synchronization parallel threading greenthreading ⎕tid	Non-syntax			https://help.dyalog.com/latest/#Language/System%20Commands/tid.htm
)VARS {nm}	System Command	List variables in current namespace, optionally beginning with {nm}		information listing report ¯2.1 ¯2.2 ¯2.3 ¯2.6 vector start leading	Non-syntax			https://help.dyalog.com/latest/#Language/System%20Commands/vars.htm
)WSID {ws}	System Command	Set or report the name of the active workspace		identification filepath filename ⎕wsid	Non-syntax			https://help.dyalog.com/latest/#Language/System%20Commands/wsid.htm
2÷¯1+5*÷2	Mathematical	Golden ratio (direct formula)		phi φ ϕ ɸ 1.618033988749894848204586834365638 0.618033988749894848204586834365638	Constant	Expression	https://tio.run/##SyzI0U2pTMzJT////1Hf1EdtExSMDm8/tN5Q21Tr8Haj//8B	
+/∧\B	Boolean/Logical	Fast: The number of leading 1s in each row of B	Performance	speed optimised optimized quick ones trues truths start beginning idiom	Expression			
17×2-645=⎕FR	Mathematical	Arithmetic precision of the system (in decimals)		comparison tolerance fuzz IEEE754 floatingpoint	Constant			
100⊥100|3↑⎕TS	System	Packing current date (YYMMDD)		Encoding	Constant			
∇ f;X;Y;Z	Definition	Tradfn/Tradop header line localisation of names X, Y, Z		localization shadow variables symbols identifiers scope stack frame scope localise localize locals declaration declare declaring [0]	Syntax			https://help.dyalog.com/latest/#Language/Defined%20Functions%20and%20Operators/TradFns/Global%20Local%20Names.htm
(X+Y)×Z	Expression	Precedence: Z×X+Y		roundparentheses grouping roundparens	Syntax			
80=⎕DR''	System	Is this Dyalog APL Unicode?		testif	Constant			
82=⎕DR''	System	Is this Dyalog APL Classic?		testif	Constant			
⊃1⎕NPARTS''	System	Current directory		folder cd pwd _CWDS _CWPS print working name filesystem	Expression			
{ns}⎕SE.UCMD Dv	Function Application	Execute user command, arguments, modifiers Dv under program control (from within 'ns')		evaluate calling running	Tradfn	Ambivalent Monadic Function, Dyadic Function		
2⎕NQ⎕SE'FileWrite'	System	Save Session configuration (including ]box and ]rows settings) to default session file		RIDE put store dyalog .dse permanent keep settings ]boxing ]output.boxing ]output.rows make persistent	Expression			
(1 1⍉Xm)←Yv	Expression	Reassign main diagonal of matrix		assignment gets is copula let redefine name naming denotes means inplace update table	Syntax			
:Implements Method {InterfaceName.MethodName}	Expression	Function implements method 'MethodName' whose syntax is specified by interface 'InterfaceName'	Keyword	declaration declare oo objectorientation	Syntax	Control		https://help.dyalog.com/latest/#Language/Object%20Oriented%20Programming/Interfaces/Interfaces.htm
∇ (X Y Z)←f	Definition	Tradfn/Tradop result name list (collects)		declaration [0] declaring defining names packing vector header	Syntax			https://help.dyalog.com/latest/#Language/Defined%20Functions%20and%20Operators/TradFns/Namelists.htm
∇ {Z}←f Y	Definition	Shy Tradfn/Tradop result		curlybraces function operator hideresult traditional header	Syntax			https://help.dyalog.com/latest/#Language/Defined%20Functions%20and%20Operators/TradFns/Model%20Syntax.htm
