SYNTAX	CATEGORY	DESCRIPTION	GROUP	KEYWORDS	CLASS	TYPE	TIO	DOCS
name←X∘⍋	Index Generation	Create a “grade-ascending-according-to” function with a hashed principal argument (fast X⍋Y for subsequent values of Y)		performance hasharray hash-array hash-table	Tacit	Monadic Function		https://help.dyalog.com/latest/#Language/Defined%20Functions%20and%20Operators/Search%20Functions%20and%20Hash.htm
name←X∘⍒	Index Generation	Create a “grade decending according to” function with a hashed principal argument (fast X⍒Y for subsequent values of Y)		performance hasharray hash-array hash-table	Tacit	Monadic Function		https://help.dyalog.com/latest/#Language/Defined%20Functions%20and%20Operators/Search%20Functions%20and%20Hash.htm
{0}¨Y	Boolean/Logical	Fast: 0 corresponding to each item of Y	Performance	speed optimised optimized quick zeroes naughts 0s zeros cell element falses falsehoods idiom	Tacit	Monadic Function		
X(f⍤0)Y	Function Application	Run f on scalars	Monadic Operator	apply	Tacit	Dyadic Function		
Mv(f⍤0 1)Nm	Function Application	Apply f between vector Mv and each column of Nm		rank suffixagreement columns distribute columwise column-wise list dimensions axes vertically columnwise	Tacit	Dyadic Function		
Mv(f⍤1)Nm	Function Application	Apply f between vector Mv and each row of Nm		rank prefixargeement rows distribute rowwise row-wise list dimensions axes horizontally	Tacit	Dyadic Function		
Xs(@1)Y	Structural	Replacing first major cell of Y with Xs	Monadic Operator	substitute merge amend replace update 1st item element	Tacit	Monadic Function		
X(f⍣¯1)Y	Function Application	Inverse: find Z such that Y ≡ X f Z	Monadic Operator	f⁻¹(x,y) f′(x,y) fʹ(x,y) opposite revert	Tacit	Monadic Function		
(f⍣¯1)Y	Function Application	Inverse: find Z such that Y ≡ f Z	Monadic Operator	f⁻¹(x) f′(x) fʹ(x) opposite revert	Tacit	Monadic Function		
Ms×∘×⍨Nv	Mathematical	Rotate figure Nv in direction of point Ms		rotation complex points	Tacit	Dyadic Function		
×∘|⍨N	Mathematical	Square without changing sign		change converting conversion	Tacit	Monadic Function		
?⍨∘≢Y	Index Generation	Random Permutation vector for Y		shuffled shuffling randompermutation randomise randomize randomlypermute	Tacit	Monadic Function		
Xm↑⍨∘≢Ym	Structural	Vertically lengthening matrix Xm to be compatible (for ,) with Ym		compatibility sameheight adjust column-wise columnwise table	Tacit	Monadic Function		
M*∘÷⍨N	Mathematical	M'th Root of N		nthroot ⁿ√ ³√ ∛ ∜	Tacit	Dyadic Function		
A*∘~⍨N	Mathematical	Conditional change of elements of N to one according to A		1 cells items changing converting conversion	Tacit	Dyadic Function		
X g⍨∘f⍨∘h Y	Composition	Split-Compose (D₂-combinator): apply g between (f X) and (h Y), that is (f X) g (h Y)		composewith splitover (fX)g(hY) (fX)ghY dovekies D2-combinator	Tacit	Dyadic Function		
+∘÷/N	Mathematical	Continued fraction with terms N		series sequence	Tacit	Monadic Function		
A⊣@⊢⍨Yv	Structural	Using Boolean array A for expanding Yv (Yv's elements at 1s in A)		ones cells items trues truths binary base-2 base2	Tacit	Dyadic Function		
∨/∘,B	Boolean/Logical	Are any true?		testif forany thereexists ∃ ⋁	Tacit	Monadic Function		
∧/∘,B	Boolean/Logical	Are all true?		testif forall ∀ ⋀	Tacit	Monadic Function		
⊃∘⍴¨Y	Array Properties	Fast: The length of the first axis of each item in X	Performance	speed optimised optimized quick cell element dimension 1st idiom	Tacit	Monadic Function		
⊂⍤¯1∘↑Yv	Structural	Pad elements of vector of arrays Yv to equal shape		list cells items	Tacit	Monadic Function		
X⊃¨∘⊂Y	Structural	Selective picking from array		chipmunk	Tacit	Monadic Function		
Iv⌷⍨∘⊂Jv	Structural	Generate consolidated left argument for successive transposes Iv⍉Jv⍉Y		optimise optimize	Tacit	Dyadic Function		
C∊⍨∘⊂Dv	Index Generation	Is string Dv a member of list of strings C		isin membership containedin has vtv vector text	Tacit	Dyadic Function		
I∊⍨∘⍳Js	Boolean/Logical	Boolean vector of length Js with ones in locations I (inverse of ⍸Bv)		inversion 1s trues truths list binary base-2 base2 ⍸⍣¯1	Tacit	Dyadic Function	https://tio.run/##ASoA1f9hcGwtZHlhbG9n///ijpXihpAgMiA0IDcg4oiK4o2o4oiY4o2zIDEw//8	
+∘÷\N	Mathematical	Continued fraction convergents with terms N		series sequence	Tacit	Monadic Function		
,[⍳2]Y	Structural	Merge the leading two axes of Y		laminate ravel combine dimensions melt fuse join along leading axis	Tacit	Monadic Function	https://tio.run/##SyzI0U2pTMzJT////1Hf1EdtExQSFUCkkYKxgsmj3i2PejcbmXBBpYB8hUQYRycaJBeLEADJwgX//wcA	
⊢∘≢⌸Y	Mathematical	Count of occurrences of each unique major cell		elements items how many repetitions times repeated	Tacit	Monadic Function		
+.×⍨Nv	Mathematical	Sum of squares of Nv		∑x² Σx² sum(x^2) Pythagorean trigonometry	Tacit	Dyadic Function		
Av+.×⍨Nv	Mathematical	Summation over subsets of Nv specified by Av			Tacit	Dyadic Function		
Xs∨.≠⍨Y	Comparison	Do rows of Y contain elements differing from Xs?		testif hasdifferent cells items	Tacit	Dyadic Function		
∘.⊢⍨Yv	Structural	Square matrix with Yv as rows		tomatrixof table	Tacit	Monadic Function	https://tio.run/##SyzI0U2pTMzJT////1Hf1EdtExQedczQe9S16FHvCgVDBSMFYwWT//8B	
∘.⊣⍨Yv	Structural	Square matrix with Yv as columns		tomatrixof table	Tacit	Monadic Function	https://tio.run/##SyzI0U2pTMzJT////1Hf1EdtExQedczQe9S1@FHvCgVDBSMFYwWT//8B	
Xv,[0.5]Yv	Structural	Two-row matrix from two vectors (repeat scalars)		table lists rows	Tacit	Monadic Function		
Mv⊥⍨∘⍪Nv	Mathematical	Evaluate polynomial with descending coefficients Mv for point(s) Nv		apply	Tacit	Dyadic Function		
Cv⎕NPUT⍨∘⊂Dv	System	Write text (vector or vector of vectors) Dv to Unicode file Cv		native files dump cat save to 🐈 ascii ansi Windows-1252 UTF-8 UTF-16LE UTF-16BE UTF-32LE UTF-32LE vtv charvec charactervector textvector string	Tacit	Dyadic Function	https://tio.run/##SyzI0U2pTMzJT///Xz23Mi0zJ1WvpKJEXUHjUd9Uv4DQkEe9Kx51zHjU1aSpoO6RmpOTr66gHp5flJOizgVU8ahtggJIobtriAKy9v//AQ	
⍉∘↑Xv Yv …	Structural	N-column matrix from N vectors		transpose columns table lists	Tacit	Monadic Function		
I(1+-)J	Mathematical	Inclusive integer difference		span distance fence-post range	Tacit	Dyadic Function		
M(×-)N	Comparison	Sign of difference (¯1:M is smaller, 0:M=N, 1:M is bigger)		signum cmp() <=> >-< spaceship space-ship three-way compare comparing comparison	Tacit	Dyadic Function		
M(1-×)N	Mathematical	Probabilistic NAND		fuzzy probability chance shefferstroke notand alternativedenial Dpq ⊼	Tacit	Dyadic Function		
M(0⌈⌊)N	Mathematical	Force numbers N to range 0≤N≤M		clamp restrictrange between 0–	Tacit	Dyadic Function		
M(⌊÷)N	Mathematical	Floored division		integer intdiv() % // divmod() F-division	Tacit	Dyadic Function	https://tio.run/##SyzI0U2pTMzJT////1Hf1EdtExQOrTc0UAAiGK3xqKfr8HZNIN8YjIHw/38A	
I(1+|)J	Mathematical	Incrementing cyclic counter J with upper limit I			Tacit	Dyadic Function		
M(|-)N	Mathematical	Absolute distance between X and Y		magnitudeof cartesian	Tacit	Dyadic Function		
(1||)N	Mathematical	Magnitude of fractional part of N		absolutedecimals	Tacit	Monadic Function		
I(1=∨)J	Mathematical	Are I and J co-prime?		coprime? relatively mutually testif	Tacit	Dyadic Function		
I(0=|)J	Mathematical	Does I divide J?		testif divides divisibility divisor ∣	Tacit	Dyadic Function		
I(0≠|)J	Mathematical	Does I not divide J?		testif divisibility divisor ∤ dividing	Tacit	Dyadic Function		
(0≤≡)Y	Array Properties	Does Y have Uniform Depth?		testif uniform? orthogonal? rectangular?	Tacit	Monadic Function		
(0=≡)Y	Array Properties	Is Y a Simple Scalar?		testif simple? flat?	Tacit	Monadic Function		
(0>≡)Y	Array Properties	Does Y have Non-Uniform Depth?		testif ragged? nonuniform? nonorthogonal? nonrectangular?	Tacit	Monadic Function		
Is(?⍴)Js	Mathematical	Choosing Is random elements of ⍳Js with replacement		roll cells items	Tacit	Dyadic Function		
(⍬≡⍴)Y	Array Properties	Is Y a Scalar?		testif	Tacit	Monadic Function		
(≢⍴)Y	Array Properties	Rank (number of dimensions) of Y		howmanyaxes numberofaxes axiscount ⍴⍴ axes	Tacit	Monadic Function		
(1↓⍴)Y	Array Properties	Dimensions of major cells		shape items elements axes	Tacit	Monadic Function		
(¯1↓⍴)Y	Array Properties	Lengths of leading axes		shape dimensions start beginning	Tacit	Monadic Function		
(¯11○+)N	Mathematical	Swap real and imaginary			Tacit	Monadic Function		
M(○×)N	Circular/Trigonometric	Area of cone with height M and radius N (excluding base)		lengths bottom	Tacit	Dyadic Function		
(2×○)N	Circular/Trigonometric	Circumference of circle with radius N		edge length	Tacit	Monadic Function		
M(¯3○÷)N	Circular/Trigonometric	Angle of right triangle with height M and width N		pythagorean	Tacit	Dyadic Function		
(¯1○÷)N	Circular/Trigonometric	Arccosecant		inverse acsc() arccsc() acosec() arccosec() arcuscosecans	Tacit	Monadic Function		
(¯2○÷)N	Circular/Trigonometric	Arcsecant		inverse asec() arcsec() arcussecans	Tacit	Monadic Function		
(¯3○÷)N	Circular/Trigonometric	Arccotangent		inverse acot() acotg() actg() actn() arcot() arccot() arccotg() acotn() arccotn() arcctg() arcctn() arcuscotangens	Tacit	Monadic Function		
(¯5○÷)N	Circular/Trigonometric	Hyperbolic area cosecant		inverse acsch() csch^-1() csch⁻¹() acosech() cosech^-1() cosech⁻¹() arcsch() arcosech() arccsch() arccosech() cosecanshyperbolicus	Tacit	Monadic Function		
(¯6○÷)N	Circular/Trigonometric	Hyperbolic area secant		inverse asech() sech^-1() sech⁻¹() arsech() arcsech() secanshyperbolicus	Tacit	Monadic Function		
(¯7○÷)N	Circular/Trigonometric	Hyperbolic area cotangent		inverse acoth() actgh() ctgh^-1() ctgh⁻¹() acotgh() cotgh^-1() cotgh⁻¹() acotnh() cotnh^-1() cotnh⁻¹() actnh() ctnh^-1() ctnh⁻¹() arctgh() arcoth() arcotgh() arctnh() arccoth() arcctgh() arccotgh() arcctnh() cotangenshyperbolicus	Tacit	Monadic Function		
(¯1*~)B	Data Conversion	Map 0/1 to ¯1/1		convert Booleans signum unit direction sgn zeros zeroes ones negative positive change changing convert converting -1 binary	Tacit	Monadic Function	https://tio.run/##SyzI0U2pTMzJT////1Hf1EdtExQ0Dq031KrTVDBUMABiIPn/PwA	
(-∘1)N	Mathematical	Decrement		decrease previous	Tacit	Monadic Function		
(1∘-)N	Mathematical	Probabilistic inverse (NOT)		fuzzy probability chance logicalnot logicalnegation logicalcomplement ¬ negate inverting	Tacit	Monadic Function		
(÷∘100)N	Mathematical	Rate corresponding to percentage N		conversion converting change changing	Tacit	Monadic Function		
(÷∘2)N	Mathematical	Halve: N÷2		halfof	Tacit	Monadic Function		
(1∘↑)Ym	Selection	First row as a row matrix (row vector)		topmostrow leading 1st table list start beginning	Tacit	Monadic Function		
(¯1∘↑)Ym	Selection	Last row as a row matrix (row vector)		bottommostrow trailing table list ending	Tacit	Monadic Function		
(*∘3)N	Mathematical	Cube		³ ^3	Tacit	Monadic Function		
(,∘1)Y	Structural	Append a column of 1s		ones trues truths	Tacit	Monadic Function		
Xv(,⍤0)Yv	Structural	Two-column matrix from two vectors (repeat scalars)		table lists columns	Tacit	Monadic Function		
Xv(,⍤1)Ym	Structural	Prefix vector to each row of matrix		prepend rows list table rows	Tacit	Dyadic Function		
Xm(,⍤1)Yv	Structural	Postfix vector to each row of matrix		append rows list table rows	Tacit	Dyadic Function		
(,⍤0)Y	Structural	Increment rank by inserting a new dimension after the trailing one		additional dimensions axes axis items elements cells extend shape add ending last columnmatrixfromvector	Tacit	Monadic Function	https://tio.run/##SyzI0U2pTMzJT////1Hf1EdtExQe9W5R0NB51LvEQFNBPTEpWZ0Li4SxggmQC5Rw/P8fAA	
(⍪∘1)Y	Structural	Append a row of 1s		ones trues truths	Tacit	Monadic Function		
Is(⊃⌽)Yv	Selection	Pick item of vector Yv at cyclic offset Is (like ⎕IO←0, default Is:¯1)		element cell list ⎕ioindependent ⎕ioindependence ⎕io-insensitive ⎕ioinsensitive Choosing choose ⎕io=0	Tacit	Dyadic Function	https://tio.run/##SyzI0U2pTMzJT////1Hf1EdtExTMFTQedTU/6tmrqaCemJSckpqm/v8/AA	
(⊃⌽)Yv	Selection	Pick last item of vector Yv		element cell list	Tacit	Monadic Function		
(1 ¯1×⊂)N	Mathematical	±N by juxtaposition		plusminus	Tacit	Monadic Function		
(¯1 1×⊂)N	Mathematical	∓N by juxtaposition		minusplus	Tacit	Monadic Function		
(10 12○⊂)N	Data Conversion	Split complex array into two-element vector of magnitude array and angle array		complexnumber polar arc() abs() separate parts absolute values list tuple converting change changing	Tacit	Monadic Function		
(9 11○⊂)N	Data Conversion	Split complex array into two-element vector of real array and imaginary array		complexnumber re() im() separate parts values list tuple converting change changing	Tacit	Monadic Function		
(⊂⍤¯1)Y	Structural	Enclose each major cell for any rank Y		dimensions higher high-rank any-rank highrank anyrank items elements axes cells	Tacit	Monadic Function		
Is(1⌷⊖)Y	Selection	Select major cell of Y at cyclic offset Is (like ⎕IO←0, default Is:¯1)		element item	Tacit	Dyadic Function		
(1⌷⊖)Y	Selection	Tail: Last major cell		Y[-1;] X[-1;] Y[-1] X[-1] Y[¯1;] X[¯1;] Y[¯1] X[¯1] trailing element item ending	Tacit	Monadic Function		
Im(⌷⍤¯1 99)Y	Selection	Select: each major cell of Im selects a cell from Y		rightshoeunderbar saneindexing ⊇ items elements index	Tacit	Dyadic Function		
(¯1+⍳)Js	Mathematical	Integers from 0 to Js-1		whole numbers naturals 1st	Tacit	Monadic Function		
(⍳≢)Y	Index Generation	Indices of Major Cells of Y		enumerate number count items elements	Tacit	Monadic Function		
(⍳⍴)Y	Index Generation	All indices of array Y			Tacit	Monadic Function		
(⍳∘1)N	Index Generation	Index of first 1 in N		indexof one locate find positionof location 1st	Tacit	Monadic Function		
X(⍳⍤1)Y	Index Generation	Indices of elements of X in corresponding rows of X (X[i;]⍳Y[i;])		indexin indexof find locate positionof rowwise row-wise locating cells items location horizontally	Tacit	Dyadic Function		
Ms(⍳,)Ns	Index Generation	Catalogue of all pairs from ⍳Ms and ⍳Ns		pairings tuples table matrix	Tacit	Dyadic Function		
(0∊≠)Y	Sets	Are any major cells identical?		testif anysame? anyequal? anyduplicates? anyidentical? anydups? items elements	Tacit	Monadic Function		
(0∊⍴)Y	Structural	Is Y an Empty Array?		testif isempty? isvoid? isnull?	Tacit	Monadic Function		
X(~∊)Y	Sets	Boolean items in X that are not in Y		isnotin membership notcontainedin hasn't doesnothave elementof ∉ cells elements binary base-2 base2	Tacit	Dyadic Function		
(∊∘⍬)Y	Boolean/Logical	Zeros, simple with same shape		zeroes naughts 0s falses falsehoods	Tacit	Monadic Function		
X(∊⍤1)Y	Sets	Which elements of X belong to corresponding row of Y (≢X ↔ ≢Y)		testif memberof isin membership containedin has cells items	Tacit	Dyadic Function		
X(1=⍸)Y	Comparison	Is Y within the range [ 1⌷X , 2⌷X )		testif ≤Y< ≤X< tao totalarrayordering interval inrange?	Tacit	Dyadic Function	https://tio.run/##SyzI0U2pTMzJT////1Hf1EdtExQMFYwVNAxtH/Xu0FQw4MIiaIhN0AiboDE2QZP//wE	
X(1≠⍸)Y	Comparison	Is Y outside the range [ 1⌷X , 2⌷X )		testif >Y≥ >X≥ tao totalarrayordering interval outsiderange?	Tacit	Dyadic Function	https://tio.run/##SyzI0U2pTMzJT////1Hf1EdtExQMFYwVNAwfdS541LtDU8GAC6uwIXZhI@zCxtiFTf7/BwA	
(⊃⍸)B	Index Generation	Index of first satisfied condition in B		1st	Tacit	Monadic Function		
X(⍸∊)Y	Index Generation	Indices of all occurrences of elements of X in Y		locate find membersof positionsof locating cells items location	Tacit	Dyadic Function		
(⊃⍋)Y	Comparison	Index of Smallest		find locate positionof least minimum lexicographically lexically locating location	Tacit	Monadic Function		
X(⍋⍳)Y	Index Generation	Grade up of Y according to key X		custom sort order ascending	Tacit	Dyadic Function		
(⍋⍋)Y	Index Generation	Ascending cardinal numbers (ranking, all different)		rising up ordinality	Tacit	Monadic Function		
(⊃⍒)Y	Comparison	Index of Largest		find locate positionof biggest greatestif maximum lexicographically lexically locating location	Tacit	Monadic Function		
X(⍒⍳)Y	Index Generation	Grade down of Y according to key X		custom sort order descending	Tacit	Dyadic Function		
(⍋⍒)Y	Index Generation	Descending cardinal numbers (ranking, all different)		falling down ordinality	Tacit	Monadic Function		
(↓⍉)Ym	Structural	Matrix to vector of column vectors		split table lists into columns	Tacit	Monadic Function	https://tio.run/##ASkA1v9hcGwtZHlhbG9n///ijpXihpAgKOKGk@KNiSkgMyA04o204o2zMTL//w	
(⍉↑)Yv	Structural	Convert inverted table to table (character data as vectors of vectors)		matrix tables transforming transformation change changing into un-inverting un-inversion un-vertion unverting unversion unvertion	Tacit	Monadic Function	https://tio.run/##SyzI0U2pTMzJT/@vnpJZXJCTWKn@qG@qc6R6Slpesfp/IPtR2wQFqJSCxqPezkdtEzUVNNQdk9QV1J1TUtPUgTxDBSMgaa5grPn/PwA	
(⍉⍤2)Y	Structural	Transpose every submatrix of Y		cant ^T ⸆ ᵀ sub-matrix sub-table subtable planes	Tacit	Monadic Function		
X(⊃⍷)Y	Boolean/Logical	If Y begins with X		prefixof? startswith? prefix?	Tacit	Dyadic Function		
X(⍸⍷)Y	Index Generation	Positions of starts of subarrays X in Y		beginningsof sub-arrays sub-strings substrings subvectors sub-vectors sub-matrices submatrices sub-sequence subsequence segmented sub-lists partitioned sublists starting points	Tacit	Dyadic Function		
(0J1⊥⊖)Nm	Mathematical	Parallel projection of 3D object in Nm			Tacit	Monadic Function		
(0⊥⍴)Y	Array Properties	Number of columns in Y		trailingshape	Tacit	Monadic Function		
M(⊥⍣¯1)N	Mathematical	N in Base M		tobase conversion converting change changing	Tacit	Dyadic Function		
(≢⍕)Js	Mathematical	Number of digit positions in Js (depends on ⎕PP)		digits	Tacit	Monadic Function		
Is(⍎⍕)N	Mathematical	Rounding N to Is decimal places		precision banking banker's bank's	Tacit	Dyadic Function		
(⍎⍕)Nv	Structural	Reshaping only one-element numeric vector Nv into a scalar (leave longer vectors as-is)		1-element singleton lists	Tacit	Monadic Function		
(⍎⍕)Nv	Mathematical	Rounding to ⎕PP precision		system	Tacit	Monadic Function		
(2|⎕DR)Y	Array Properties	Is Y numeric?		testif num? nums? datatype data-type numbers?	Tacit	Monadic Function		
(326≠⎕DR)Y	Array Properties	Is Y a Homogeneous Array?		testif homogeneous? simple? flat? single-type consistent-type uniform?	Tacit	Monadic Function		
(⊃⎕NGET)Dv	System	Read Unicode text file Dv content as simple vector		native files fetch load ascii ansi Windows-1252 UTF-8 UTF-16LE UTF-16BE UTF-32LE UTF-32LE charvec charactervector textvector single one long string	Tacit	Monadic Function	https://tio.run/##SyzI0U2pTMzJT///X@NRV5O6R2pOTr66gnp4flFOirrmo76pfgGhIQrquZVpmTmpeiUVJepcQMFHbRMUgOqbQfLuriGaKAr@/wcA	
(20⎕DT⊆)J	Data Conversion	Convert ⎕TS-style timestamps to UNIX times		UnixTime PosixTime UnixEpochTime 1970	Tacit	Monadic Function		
(¯1⎕DT⊆)J	Data Conversion	Convert (Dyalog date number) date-times to ⎕TS-style time stamps		datetimes date-times millisecond YMDhmsfff ms IDNToDate	Tacit	Monadic Function		https://help.dyalog.com/latest/#Language/System%20Functions/dt.htm
(¯10⎕DT⊆)J	Data Conversion	Convert (⎕TS-style or Dyalog date number) date-times to ISO day-of-year components time stamps		datetimes date-times YDhmsffffff μs	Tacit	Monadic Function		https://help.dyalog.com/latest/#Language/System%20Functions/dt.htm
(¯11⎕DT⊆)J	Data Conversion	Convert (⎕TS-style or Dyalog date number) date-times to ISO day-of-week components time stamps		datetimes date-times YWDhmsffffff μs	Tacit	Monadic Function		https://help.dyalog.com/latest/#Language/System%20Functions/dt.htm
(¯2⎕DT⊆)J	Data Conversion	Convert (⎕TS-style or Dyalog date number) date-times to microsecond precision ⎕TS-style time stamps		datetimes date-times YMDhmsffffff μs	Tacit	Monadic Function		https://help.dyalog.com/latest/#Language/System%20Functions/dt.htm
(¯20⎕DT⊆)J	Data Conversion	Convert (⎕TS-style or Dyalog date number) date-times to decimal encoded date and time stamps		datetimes date-times YWDhms	Tacit	Monadic Function		https://help.dyalog.com/latest/#Language/System%20Functions/dt.htm
(¯3⎕DT⊆)J	Data Conversion	Convert (⎕TS-style or Dyalog date number) date-times to nanosecond precision ⎕TS-style time stamps		datetimes date-times j expanded digit time YMDhmsfffffffff ns	Tacit	Monadic Function		https://help.dyalog.com/latest/#Language/System%20Functions/dt.htm
(¯30⎕DT⊆)J	Data Conversion	Convert (⎕TS-style or Dyalog date number) date-times to DateTimePicker format time stamps		datetimes date-times IDNhms	Tacit	Monadic Function		https://help.dyalog.com/latest/#Language/System%20Functions/dt.htm
As↓⍨∘-⍨Y	Structural	Conditional drop of last element of Y		trailing cell item delete remove ending without removing erasing erase eliminate eliminating deleting	Tacit	Dyadic Function		
Is↑⍨∘-⍨Yv	Structural	Padding Yv on the left to width Is		extend left-align leftalign text string	Tacit	Dyadic Function		
X⍴⍨∘⍴⍨Y	Structural	Array with shape of X and content of Y		reshape mould mold form fill	Tacit	Dyadic Function		
,∘⊆∘,Y	Structural	Normalise scalar/vector/vector of scalars/vectors to vector of vectors		normalize nested nesting flexible consistent input	Tacit	Monadic Function		
Iv⌷⍨∘⊂⍨Y	Selection	Select major cells Iv from Y		rightshoeunderbar saneindexing ⊇ items elements getting picking selecting	Tacit	Dyadic Function		
Iv⌷⍨∘⊂⍨Y	Selection	Permute: Reorder major cells of Y according tot permutation vector Iv		rightshoeunderbar ⊇ items elements permutation permuting	Tacit	Dyadic Function		
X⍳⍨∘⊖⍨Y	Index Generation	Index of last occurrence of major cells Y in X, counted from the rear		indexin indexof find locate positionof locating items elements location reverse back trailing ending	Tacit	Dyadic Function	https://tio.run/##SyzI0U2pTMzJT////1Hf1EdtExTUE5OKEpMTU0CUusKj3s2Pelc86pjxqGsakAGSVf//HwA	
⍳∘≢∘⍴Y	Index Generation	All axes of array Y		dimensions	Tacit	Monadic Function		
Iv∊∘⍳∘≢Y	Structural	Starting points for Y in indices pointed by Iv		segmented partitioned starts beginnings	Tacit	Dyadic Function		
+\⍣2∘⍳Js	Mathematical	First Js triangular pyramidal numbers		figurative tetrahedral oeisA000292 oeisA292 1st	Tacit	Monadic Function		
⌽∘⍉∘⌽Ym	Structural	Reflect counter-diagonally		mirroring reflecting reflection counterdiagonally mirror	Tacit	Monadic Function		
Is⌿∘⍉∘⍪Yv	Structural	Matrix with Is rows, each consisting of Yv		fill table	Tacit	Dyadic Function		
Xs+.=∘,Y	Comparison	Number of occurrences of scalar Xs in array Y		count tally	Tacit	Dyadic Function		
M(⊢-|)N	Mathematical	Largest whole multiple of M less than or equal to N (N rounded down to closest smaller multiple of M)		without less nodivisionremainder bar() noresidual intmultiples smaller ≤ integer unit floor	Tacit	Dyadic Function	https://tio.run/##SyzI0U2pTMzJT////1Hf1EdtExQMDRQ0HnUt0q3RVLAEcQwNFQwtFYwMFIwM//8HAA	
(×|⊢)N	Mathematical	Fractional part with sign		decimals	Tacit	Monadic Function		
(⊢=+)N	Mathematical	Is N real?		testif	Tacit	Monadic Function		
(⌊=⊢)N	Mathematical	Is N integer?		testif whole number?	Tacit	Monadic Function		
(⊢≠+)N	Mathematical	Is N complex?		testif	Tacit	Monadic Function		
(⌽≡⊢)Dv	Text	Is Dv a palindrome?		testif string	Tacit	Monadic Function	https://tio.run/##SyzI0U2pTMzJT////1Hf1EdtExQ0HvXsfdS58FHXIk0F9aLE5NTkxCJ1LmySQAmQvPr//wA	
I(⌊1+⍟)J	Mathematical	Length to represent J in base I		width representation required digits positions	Tacit	Dyadic Function		
(¯2○1○⊢)N	Circular/Trigonometric	Complementary Angle		○/	Tacit	Monadic Function		
(1⍴⍨≢)Ym	Boolean/Logical	Vector having as many ones as Ym has rows		1s trues truths list	Tacit	Monadic Function		
(*×⍨)N	Mathematical	Limit of nominal rate N when continuously compounded		interest	Tacit	Monadic Function		
(180÷⍨○)N	Circular/Trigonometric	N Degrees in Radians			Tacit	Monadic Function		
(!-∘1)N	Mathematical	Gamma function of N		gamma() Γ	Tacit	Monadic Function		
(÷1∘○)N	Circular/Trigonometric	Cosecant		csc() cosec() cosecans	Tacit	Monadic Function		
(÷2∘○)N	Circular/Trigonometric	Secant		sec() secans	Tacit	Monadic Function		
(÷3∘○)N	Circular/Trigonometric	Cotangent		cot() cotg() ctg() cotn() ctn() cotangens	Tacit	Monadic Function		
(÷5∘○)N	Circular/Trigonometric	Hyperbolic cosecant		csch() cosech() cosecanshyperbolicus	Tacit	Monadic Function		
(÷6∘○)N	Circular/Trigonometric	Hyperbolic secant		sech() secanshyperbolicus	Tacit	Monadic Function		
(÷7∘○)N	Circular/Trigonometric	Hyperbolic cotangent		coth() ctgh() cotgh() ctnh() cotnh() cotangenshyperbolicus	Tacit	Monadic Function		
(○*∘2)N	Circular/Trigonometric	Area of circle with radius N		length	Tacit	Monadic Function		
(~2∘|)J	Mathematical	J is Even			Tacit	Monadic Function		
{X} f∘g⍨⍨Y	Composition	J Hook: Y f g Y when monadic and X f g Y when dyadic			Tacit	Monadic Function		
~∘' '¨D	Text	Remove blanks in each string		deletespaces spaces drop without removing erasing erase eliminate eliminating delete deleting	Tacit	Monadic Function		
(¯2-/⊢)N	Mathematical	Deltas: (N[2]-N[1])(N[3]-N[2])(N[4]-N[3])…		pairwisedifferences changes steps	Tacit	Monadic Function		
(¯2÷/⊢)N	Mathematical	Ratio of each number in a list to its predecessor: (N[2]÷N[1])(N[3]÷N[2])(N[4]÷N[3])…		pairwiseratios vector	Tacit	Monadic Function		
(⌈/|)N	Mathematical	Largest row-wise magnitude found in N		rowwise horizontally biggest greatestif maximum absolute value	Tacit	Monadic Function		
